,searchTerms,rank,title,snippet,displayLink,link,queryTime,totalResults,cacheId,count,cseName,cx,formattedSearchTime,formattedTotalResults,formattedUrl,htmlFormattedUrl,htmlSnippet,htmlTitle,inputEncoding,kind,outputEncoding,pagemap,safe,searchTime,startIndex,cse_thumbnail,metatags,cse_image,xfn,softwaresourcecode,document,listitem,organization,webpage,Person,hatomfeed,charset,viewport,keyword,og:image,og:type,twitter:card,twitter:title,clientsideingraphs,al:ios:app_name,linkedin:pagetag,og:title,al:android:package,pagekey,locale,al:ios:url,og:description,al:ios:app_store_id,twitter:image,al:android:url,twitter:site,twitter:description,og:url,al:android:app_name,msapplication-tilecolor,theme-color,egms.systemid,og:image:alt,og:image:width,og:site_name,og:image:height,og:image:secure_url,apple-mobile-web-app-status-bar-style,mobile-web-app-capable,platform,og:keywords,format-detection,facebook-domain-verification,metatag_title,handheldfriendly,mobileoptimized,docsearch:language,article:published_time,twitter:label1,twitter:label2,msapplication-tileimage,twitter:data1,twitter:data2,article:modified_time,og:locale,referrer,imdb:subpagetype,imdb:pageconst,next-head-count,twitter:image:alt,og:locale:alternate,imdb:pagetype,octolytics-url,apple-itunes-app,hovercard-subject-tag,turbo-body-classes,html-safe-nonce,expected-hostname,browser-errors-url,octolytics-dimension-user_login,hostname,browser-stats-url,visitor-payload,github-keyboard-shortcuts,octolytics-dimension-repository_id,octolytics-dimension-repository_network_root_nwo,enabled-features,optimizely-datafile,visitor-hmac,turbo-cache-control,request-id,analytics-location,color-scheme,octolytics-dimension-repository_is_fork,go-import,browser-optimizely-client-errors-url,twitter:image:src,octolytics-dimension-user_id,octolytics-dimension-repository_public,fb:app_id,octolytics-dimension-repository_network_root_id,octolytics-dimension-repository_nwo,og:image:type,application-name,msapplication-tooltip,apple-mobile-web-app-title,msapplication-navbutton-color,apple-mobile-web-app-capable,fb:profile_id,og:rich_attachment,google-signin-client-id,google-signin-scope,author,contact,follow.it-verification-code-alrgnmtwb0zjumpkwgdnenhpuvz4wwtlavdtnfjzq1jzwtforktxvlhxs0g0dg1gtct3ddhkr3beeknwv0lnzhbesgxmrejqnedkue9lmktbulleqlppqw8zdwrscunku0t0b1hosllvoxlyt2p4wgzmctvptk5ksnk3n2fhutb8duc5b2llv212dfgzu3zfcfbjym1xl0c0a1h1zhk5ehrxvmluqjnkrk5sst0=,twitter:url,site_name,vicurrentdatetime,url,virtualfolder,og:updated_time,pinterestapp:repins,pinterestapp:pinboard,pinterestapp:pinner,csrf-token,csrf-param,article:section,brightspot.cached,og:image:url,brightspot.syncenvironment,site-id,lens,siteprimaryurl,brightspot.environment,brightspot.contentid,page-name,platform-worker,profile:last_name,litmsprofilename,profile:first_name,ubba
0,desss,1,DESSS: Mobile App Development|Mobile App Consulting ...,"DESSS is one of the leading Software Development and Application Development companies in Houston offering high-quality, cost-effective, and customized ...",www.desss.com,https://www.desss.com/,2023-01-02 08:39:11.637447+00:00,85900000,rJsAzNzAXAQJ,10,desss,a283296b1cb8147fd,0.32,"85,900,000",https://www.desss.com/,https://www.<b>desss</b>.com/,"<b>DESSS</b> is one of the leading Software Development and Application Development companies in Houston offering high-quality, cost-effective, and customized&nbsp;...",<b>DESSS</b>: Mobile App Development|Mobile App Consulting ...,utf8,customsearch#result,utf8,"{'cse_thumbnail': [{'src': 'https://encrypted-tbn3.gstatic.com/images?q=tbn:ANd9GcSlbObyDmzFqdsTYP6gZgmBDX6tfVT7ohOtym1yaJEDsGA6TjGRILPEcZ0', 'width': '240', 'height': '136'}], 'metatags': [{'charset': 'utf-8', 'viewport': 'width=device-width, height=device-height, initial-scale=1, minimum-scale=1, maximum-scale=5', 'keyword': 'mobile app development, mobile app consulting, mobile app consultant, app development, mobile app developer, android app development, mobile app development company, P21 Consulting, P21 implementation, p21 migration, p21 consulting, P21 consultant, p21 customization | P21 migration | p21 upgrade| p21 Support | P21 Maintenance| Houston, Austin, Dallas, San Antonio, , New York, New Jersey, Chicago, Philadelphia | Texas | Los Angeles | San Francisco'}], 'cse_image': [{'src': 'https://www.desss.com/assets/images/desss/logo/240%20x%20136.webp'}]}",off,0.317102,1,"[{'src': 'https://encrypted-tbn3.gstatic.com/images?q=tbn:ANd9GcSlbObyDmzFqdsTYP6gZgmBDX6tfVT7ohOtym1yaJEDsGA6TjGRILPEcZ0', 'width': '240', 'height': '136'}]","[{'charset': 'utf-8', 'viewport': 'width=device-width, height=device-height, initial-scale=1, minimum-scale=1, maximum-scale=5', 'keyword': 'mobile app development, mobile app consulting, mobile app consultant, app development, mobile app developer, android app development, mobile app development company, P21 Consulting, P21 implementation, p21 migration, p21 consulting, P21 consultant, p21 customization | P21 migration | p21 upgrade| p21 Support | P21 Maintenance| Houston, Austin, Dallas, San Antonio, , New York, New Jersey, Chicago, Philadelphia | Texas | Los Angeles | San Francisco'}]",[{'src': 'https://www.desss.com/assets/images/desss/logo/240%20x%20136.webp'}],,,,,,,,,utf-8,"width=device-width, height=device-height, initial-scale=1, minimum-scale=1, maximum-scale=5","mobile app development, mobile app consulting, mobile app consultant, app development, mobile app developer, android app development, mobile app development company, P21 Consulting, P21 implementation, p21 migration, p21 consulting, P21 consultant, p21 customization | P21 migration | p21 upgrade| p21 Support | P21 Maintenance| Houston, Austin, Dallas, San Antonio, , New York, New Jersey, Chicago, Philadelphia | Texas | Los Angeles | San Francisco",,,,,,,,,,,,,,,,,,,,,,,,,,,,,,,,,,,,,,,,,,,,,,,,,,,,,,,,,,,,,,,,,,,,,,,,,,,,,,,,,,,,,,,,,,,,,,,,,,,,,,,,,,,,,,,,,,,,,,,,,,
1,desss,2,DESSS Inc | LinkedIn,"DESSS Inc | 276 followers on LinkedIn. Award Winner - Best Web Design and Development Company for 10 consecutive years | DESSS Inc, one of the leading Web ...",www.linkedin.com,https://www.linkedin.com/company/desss-inc,2023-01-02 08:39:11.637447+00:00,85900000,,10,desss,a283296b1cb8147fd,0.32,"85,900,000",https://www.linkedin.com/company/desss-inc,https://www.linkedin.com/company/<b>desss</b>-inc,"<b>DESSS</b> Inc | 276 followers on LinkedIn. Award Winner - Best Web Design and Development Company for 10 consecutive years | <b>DESSS</b> Inc, one of the leading Web&nbsp;...",<b>DESSS</b> Inc | LinkedIn,utf8,customsearch#result,utf8,"{'cse_thumbnail': [{'src': 'https://encrypted-tbn3.gstatic.com/images?q=tbn:ANd9GcSk4P9Bs_m6vAQO-0xU6pv9am8VoI0jb2kSuDuyL0ac995R6BpUNvG3ddRV', 'width': '200', 'height': '200'}], 'metatags': [{'og:image': 'https://media.licdn.com/dms/image/C560BAQF26-wF1_IbAQ/company-logo_200_200/0/1641625994350?e=2147483647&v=beta&t=2Fo3PssTIbYduOgvtsBNFkjQQtqbdnwI28FKD3lEbv8', 'og:type': 'article', 'twitter:card': 'summary', 'twitter:title': 'DESSS Inc | LinkedIn', 'clientsideingraphs': '1', 'al:ios:app_name': 'LinkedIn', 'linkedin:pagetag': 'noncanonical_subdomain=control', 'og:title': 'DESSS Inc | LinkedIn', 'al:android:package': 'com.linkedin.android', 'pagekey': 'p_org_guest_company_overview', 'locale': 'en_US', 'al:ios:url': 'https://www.linkedin.com/company/desss-inc', 'og:description': 'DESSS Inc | 276 followers on LinkedIn. Award Winner - Best Web Design and Development Company for 10 consecutive years  | DESSS Inc, one of the leading Web Design and Mobile App Development companies in Houston Texas, comprises a team of knowledgeable people who serve any IT requirements with due diligence and dedication. We deliver the following services - Application services, Cloud services, DBA, Managed IT services, Mobile App Development, Web Development, Share point services, Digital Marketing Services, Staffing solutions, transcription services, etc. We have been awarded as the best Web Design and Development Company for 10 consecutive years by Houston Business Journals.', 'al:ios:app_store_id': '288429040', 'twitter:image': 'https://media.licdn.com/dms/image/C560BAQF26-wF1_IbAQ/company-logo_200_200/0/1641625994350?e=2147483647&v=beta&t=2Fo3PssTIbYduOgvtsBNFkjQQtqbdnwI28FKD3lEbv8', 'al:android:url': 'https://www.linkedin.com/company/desss-inc', 'twitter:site': '@linkedin', 'viewport': 'width=device-width, initial-scale=1.0', 'twitter:description': 'DESSS Inc | 276 followers on LinkedIn. Award Winner - Best Web Design and Development Company for 10 consecutive years  | DESSS Inc, one of the leading Web Design and Mobile App Development companies in Houston Texas, comprises a team of knowledgeable people who serve any IT requirements with due diligence and dedication. We deliver the following services - Application services, Cloud services, DBA, Managed IT services, Mobile App Development, Web Development, Share point services, Digital Marketing Services, Staffing solutions, transcription services, etc. We have been awarded as the best Web Design and Development Company for 10 consecutive years by Houston Business Journals.', 'og:url': 'https://www.linkedin.com/company/desss-inc', 'al:android:app_name': 'LinkedIn'}], 'cse_image': [{'src': 'https://media.licdn.com/dms/image/C560BAQF26-wF1_IbAQ/company-logo_200_200/0/1641625994350?e=2147483647&v=beta&t=2Fo3PssTIbYduOgvtsBNFkjQQtqbdnwI28FKD3lEbv8'}]}",off,0.317102,1,"[{'src': 'https://encrypted-tbn3.gstatic.com/images?q=tbn:ANd9GcSk4P9Bs_m6vAQO-0xU6pv9am8VoI0jb2kSuDuyL0ac995R6BpUNvG3ddRV', 'width': '200', 'height': '200'}]","[{'og:image': 'https://media.licdn.com/dms/image/C560BAQF26-wF1_IbAQ/company-logo_200_200/0/1641625994350?e=2147483647&v=beta&t=2Fo3PssTIbYduOgvtsBNFkjQQtqbdnwI28FKD3lEbv8', 'og:type': 'article', 'twitter:card': 'summary', 'twitter:title': 'DESSS Inc | LinkedIn', 'clientsideingraphs': '1', 'al:ios:app_name': 'LinkedIn', 'linkedin:pagetag': 'noncanonical_subdomain=control', 'og:title': 'DESSS Inc | LinkedIn', 'al:android:package': 'com.linkedin.android', 'pagekey': 'p_org_guest_company_overview', 'locale': 'en_US', 'al:ios:url': 'https://www.linkedin.com/company/desss-inc', 'og:description': 'DESSS Inc | 276 followers on LinkedIn. Award Winner - Best Web Design and Development Company for 10 consecutive years  | DESSS Inc, one of the leading Web Design and Mobile App Development companies in Houston Texas, comprises a team of knowledgeable people who serve any IT requirements with due diligence and dedication. We deliver the following services - Application services, Cloud services, DBA, Managed IT services, Mobile App Development, Web Development, Share point services, Digital Marketing Services, Staffing solutions, transcription services, etc. We have been awarded as the best Web Design and Development Company for 10 consecutive years by Houston Business Journals.', 'al:ios:app_store_id': '288429040', 'twitter:image': 'https://media.licdn.com/dms/image/C560BAQF26-wF1_IbAQ/company-logo_200_200/0/1641625994350?e=2147483647&v=beta&t=2Fo3PssTIbYduOgvtsBNFkjQQtqbdnwI28FKD3lEbv8', 'al:android:url': 'https://www.linkedin.com/company/desss-inc', 'twitter:site': '@linkedin', 'viewport': 'width=device-width, initial-scale=1.0', 'twitter:description': 'DESSS Inc | 276 followers on LinkedIn. Award Winner - Best Web Design and Development Company for 10 consecutive years  | DESSS Inc, one of the leading Web Design and Mobile App Development companies in Houston Texas, comprises a team of knowledgeable people who serve any IT requirements with due diligence and dedication. We deliver the following services - Application services, Cloud services, DBA, Managed IT services, Mobile App Development, Web Development, Share point services, Digital Marketing Services, Staffing solutions, transcription services, etc. We have been awarded as the best Web Design and Development Company for 10 consecutive years by Houston Business Journals.', 'og:url': 'https://www.linkedin.com/company/desss-inc', 'al:android:app_name': 'LinkedIn'}]",[{'src': 'https://media.licdn.com/dms/image/C560BAQF26-wF1_IbAQ/company-logo_200_200/0/1641625994350?e=2147483647&v=beta&t=2Fo3PssTIbYduOgvtsBNFkjQQtqbdnwI28FKD3lEbv8'}],,,,,,,,,,"width=device-width, initial-scale=1.0",,https://media.licdn.com/dms/image/C560BAQF26-wF1_IbAQ/company-logo_200_200/0/1641625994350?e=2147483647&v=beta&t=2Fo3PssTIbYduOgvtsBNFkjQQtqbdnwI28FKD3lEbv8,article,summary,DESSS Inc | LinkedIn,1,LinkedIn,noncanonical_subdomain=control,DESSS Inc | LinkedIn,com.linkedin.android,p_org_guest_company_overview,en_US,https://www.linkedin.com/company/desss-inc,"DESSS Inc | 276 followers on LinkedIn. Award Winner - Best Web Design and Development Company for 10 consecutive years  | DESSS Inc, one of the leading Web Design and Mobile App Development companies in Houston Texas, comprises a team of knowledgeable people who serve any IT requirements with due diligence and dedication. We deliver the following services - Application services, Cloud services, DBA, Managed IT services, Mobile App Development, Web Development, Share point services, Digital Marketing Services, Staffing solutions, transcription services, etc. We have been awarded as the best Web Design and Development Company for 10 consecutive years by Houston Business Journals.",288429040,https://media.licdn.com/dms/image/C560BAQF26-wF1_IbAQ/company-logo_200_200/0/1641625994350?e=2147483647&v=beta&t=2Fo3PssTIbYduOgvtsBNFkjQQtqbdnwI28FKD3lEbv8,https://www.linkedin.com/company/desss-inc,@linkedin,"DESSS Inc | 276 followers on LinkedIn. Award Winner - Best Web Design and Development Company for 10 consecutive years  | DESSS Inc, one of the leading Web Design and Mobile App Development companies in Houston Texas, comprises a team of knowledgeable people who serve any IT requirements with due diligence and dedication. We deliver the following services - Application services, Cloud services, DBA, Managed IT services, Mobile App Development, Web Development, Share point services, Digital Marketing Services, Staffing solutions, transcription services, etc. We have been awarded as the best Web Design and Development Company for 10 consecutive years by Houston Business Journals.",https://www.linkedin.com/company/desss-inc,LinkedIn,,,,,,,,,,,,,,,,,,,,,,,,,,,,,,,,,,,,,,,,,,,,,,,,,,,,,,,,,,,,,,,,,,,,,,,,,,,,,,,,,,,,,,,,,,,,,,,,,,,,,,
2,desss,3,Discretionary East Sussex Support Scheme (DESSS),The Discretionary East Sussex Support Scheme (DESSS) provides emergency help in certain situations. It does not provide cash or loans but may provide the ...,www.eastsussex.gov.uk,https://www.eastsussex.gov.uk/social-care/benefits/discretionary-east-sussex-support-scheme-desss,2023-01-02 08:39:11.637447+00:00,85900000,Eq9LlpKIhdwJ,10,desss,a283296b1cb8147fd,0.32,"85,900,000",https://www.eastsussex.gov.uk/.../discretionary-east-sussex-support-scheme- desss,https://www.eastsussex.gov.uk/.../discretionary-east-sussex-support-scheme- <b>desss</b>,The <b>Discretionary East Sussex Support Scheme</b> (<b>DESSS</b>) provides emergency help in certain situations. It does not provide cash or loans but may provide the&nbsp;...,<b>Discretionary East Sussex Support Scheme</b> (<b>DESSS</b>),utf8,customsearch#result,utf8,"{'metatags': [{'msapplication-tilecolor': '#00a1de', 'theme-color': '#ffffff', 'og:type': 'article', 'twitter:card': 'summary', 'twitter:title': 'Help with food and utilities', 'twitter:site': '@eastsussexcc', 'viewport': 'width=device-width, initial-scale=1, viewport-fit=cover', 'twitter:description': 'How to get help with food', 'og:title': 'Help with food and utilities', 'og:url': 'https://www.eastsussex.gov.uk/social-care/benefits/discretionary-east-sussex-support-scheme-desss/food-utilities', 'egms.systemid': '3508'}]}",off,0.317102,1,,"[{'msapplication-tilecolor': '#00a1de', 'theme-color': '#ffffff', 'og:type': 'article', 'twitter:card': 'summary', 'twitter:title': 'Help with food and utilities', 'twitter:site': '@eastsussexcc', 'viewport': 'width=device-width, initial-scale=1, viewport-fit=cover', 'twitter:description': 'How to get help with food', 'og:title': 'Help with food and utilities', 'og:url': 'https://www.eastsussex.gov.uk/social-care/benefits/discretionary-east-sussex-support-scheme-desss/food-utilities', 'egms.systemid': '3508'}]",,,,,,,,,,,"width=device-width, initial-scale=1, viewport-fit=cover",,,article,summary,Help with food and utilities,,,,Help with food and utilities,,,,,,,,,@eastsussexcc,How to get help with food,https://www.eastsussex.gov.uk/social-care/benefits/discretionary-east-sussex-support-scheme-desss/food-utilities,,#00a1de,#ffffff,3508,,,,,,,,,,,,,,,,,,,,,,,,,,,,,,,,,,,,,,,,,,,,,,,,,,,,,,,,,,,,,,,,,,,,,,,,,,,,,,,,,,,,,,,,,,,,,,,,,,,
3,desss,4,Desss - Crunchbase Company Profile & Funding,Desss is a web design company located in Houston.,www.crunchbase.com,https://www.crunchbase.com/organization/desss,2023-01-02 08:39:11.637447+00:00,85900000,IJC8hOBlhLkJ,10,desss,a283296b1cb8147fd,0.32,"85,900,000",https://www.crunchbase.com/organization/desss,https://www.crunchbase.com/organization/<b>desss</b>,<b>Desss</b> is a web design company located in Houston.,<b>Desss</b> - Crunchbase Company Profile &amp; Funding,utf8,customsearch#result,utf8,"{'cse_thumbnail': [{'src': 'https://encrypted-tbn3.gstatic.com/images?q=tbn:ANd9GcTvntVEgKygjLifLdv8sasbp_HSPVbCHi5L-wSTgp0rTQ1IQF1U1SQ-81A', 'width': '225', 'height': '225'}], 'metatags': [{'og:image': 'https://res.cloudinary.com/crunchbase-production/image/upload/c_lpad,h_256,w_256,f_auto,q_auto:eco,dpr_1/1d7673d869ef73502d71', 'og:type': 'website', 'og:image:alt': 'Desss', 'og:image:width': '256', 'og:site_name': 'Crunchbase', 'viewport': 'width=device-width, minimum-scale=1.0, initial-scale=1.0', 'og:title': 'Desss - Crunchbase Company Profile & Funding', 'og:image:height': '256', 'og:url': 'https://www.crunchbase.com/organization/desss', 'og:description': 'Desss is a web design company located in Houston.', 'og:image:secure_url': 'https://res.cloudinary.com/crunchbase-production/image/upload/c_lpad,h_256,w_256,f_auto,q_auto:eco,dpr_1/1d7673d869ef73502d71'}], 'cse_image': [{'src': 'https://res.cloudinary.com/crunchbase-production/image/upload/c_lpad,h_256,w_256,f_auto,q_auto:eco,dpr_1/1d7673d869ef73502d71'}]}",off,0.317102,1,"[{'src': 'https://encrypted-tbn3.gstatic.com/images?q=tbn:ANd9GcTvntVEgKygjLifLdv8sasbp_HSPVbCHi5L-wSTgp0rTQ1IQF1U1SQ-81A', 'width': '225', 'height': '225'}]","[{'og:image': 'https://res.cloudinary.com/crunchbase-production/image/upload/c_lpad,h_256,w_256,f_auto,q_auto:eco,dpr_1/1d7673d869ef73502d71', 'og:type': 'website', 'og:image:alt': 'Desss', 'og:image:width': '256', 'og:site_name': 'Crunchbase', 'viewport': 'width=device-width, minimum-scale=1.0, initial-scale=1.0', 'og:title': 'Desss - Crunchbase Company Profile & Funding', 'og:image:height': '256', 'og:url': 'https://www.crunchbase.com/organization/desss', 'og:description': 'Desss is a web design company located in Houston.', 'og:image:secure_url': 'https://res.cloudinary.com/crunchbase-production/image/upload/c_lpad,h_256,w_256,f_auto,q_auto:eco,dpr_1/1d7673d869ef73502d71'}]","[{'src': 'https://res.cloudinary.com/crunchbase-production/image/upload/c_lpad,h_256,w_256,f_auto,q_auto:eco,dpr_1/1d7673d869ef73502d71'}]",,,,,,,,,,"width=device-width, minimum-scale=1.0, initial-scale=1.0",,"https://res.cloudinary.com/crunchbase-production/image/upload/c_lpad,h_256,w_256,f_auto,q_auto:eco,dpr_1/1d7673d869ef73502d71",website,,,,,,Desss - Crunchbase Company Profile & Funding,,,,,Desss is a web design company located in Houston.,,,,,,https://www.crunchbase.com/organization/desss,,,,,Desss,256,Crunchbase,256,"https://res.cloudinary.com/crunchbase-production/image/upload/c_lpad,h_256,w_256,f_auto,q_auto:eco,dpr_1/1d7673d869ef73502d71",,,,,,,,,,,,,,,,,,,,,,,,,,,,,,,,,,,,,,,,,,,,,,,,,,,,,,,,,,,,,,,,,,,,,,,,,,,,,,,,,,,,,,,,,,,,,,
4,desss,5,DESTINI (@luhh.desss) • Instagram photos and videos,"120k Followers, 887 Following, 38 Posts - See Instagram photos and videos from DESTINI ♛ (@luhh.desss)",www.instagram.com,https://www.instagram.com/luhh.desss/?hl=en,2023-01-02 08:39:11.637447+00:00,85900000,,10,desss,a283296b1cb8147fd,0.32,"85,900,000",https://www.instagram.com/luhh.desss/?hl=en,https://www.instagram.com/luhh.<b>desss</b>/?hl=en,"120k Followers, 887 Following, 38 Posts - See Instagram photos and videos from DESTINI ♛ (@luhh.<b>desss</b>)",DESTINI (@luhh.<b>desss</b>) • Instagram photos and videos,utf8,customsearch#result,utf8,"{'xfn': [{}], 'metatags': [{'og:image': 'https://scontent-atl3-1.cdninstagram.com/v/t51.2885-19/316507712_792806941780426_7899924806661813938_n.jpg?stp=dst-jpg_s150x150&_nc_ht=scontent-atl3-1.cdninstagram.com&_nc_cat=110&_nc_ohc=FhzaglcriEoAX83tB50&edm=ABfd0MgBAAAA&ccb=7-5&oh=00_AfA7wZtDPZmU_ZBo5H_wixNogPOhrENYuhQ8IYC5zWjWcQ&oe=63B2D278&_nc_sid=7bff83', 'theme-color': '#ffffff', 'og:type': 'profile', 'al:ios:app_name': 'Instagram', 'og:title': '𝒟𝐸𝒮𝒯𝐼𝒩𝐼 ♛ (@luhh.desss) • Instagram photos and videos', 'al:android:package': 'com.instagram.android', 'al:ios:url': 'instagram://user?username=luhh.desss', 'og:description': '120k Followers, 887 Following, 38 Posts - See Instagram photos and videos from 𝒟𝐸𝒮𝒯𝐼𝒩𝐼 ♛ (@luhh.desss)', 'al:ios:app_store_id': '389801252', 'al:android:url': 'https://www.instagram.com/_u/luhh.desss/', 'apple-mobile-web-app-status-bar-style': 'default', 'viewport': 'width=device-width, initial-scale=1, minimum-scale=1, maximum-scale=1, viewport-fit=cover', 'mobile-web-app-capable': 'yes', 'og:url': 'https://www.instagram.com/luhh.desss/', 'al:android:app_name': 'Instagram'}], 'cse_image': [{'src': 'https://scontent-atl3-1.cdninstagram.com/v/t51.2885-19/316507712_792806941780426_7899924806661813938_n.jpg?stp=dst-jpg_s150x150&_nc_ht=scontent-atl3-1.cdninstagram.com&_nc_cat=110&_nc_ohc=FhzaglcriEoAX83tB50&edm=ABfd0MgBAAAA&ccb=7-5&oh=00_AfA7wZtDPZmU_ZBo5H_wixNogPOhrENYuhQ8IYC5zWjWcQ&oe=63B2D278&_nc_sid=7bff83'}]}",off,0.317102,1,,"[{'og:image': 'https://scontent-atl3-1.cdninstagram.com/v/t51.2885-19/316507712_792806941780426_7899924806661813938_n.jpg?stp=dst-jpg_s150x150&_nc_ht=scontent-atl3-1.cdninstagram.com&_nc_cat=110&_nc_ohc=FhzaglcriEoAX83tB50&edm=ABfd0MgBAAAA&ccb=7-5&oh=00_AfA7wZtDPZmU_ZBo5H_wixNogPOhrENYuhQ8IYC5zWjWcQ&oe=63B2D278&_nc_sid=7bff83', 'theme-color': '#ffffff', 'og:type': 'profile', 'al:ios:app_name': 'Instagram', 'og:title': '𝒟𝐸𝒮𝒯𝐼𝒩𝐼 ♛ (@luhh.desss) • Instagram photos and videos', 'al:android:package': 'com.instagram.android', 'al:ios:url': 'instagram://user?username=luhh.desss', 'og:description': '120k Followers, 887 Following, 38 Posts - See Instagram photos and videos from 𝒟𝐸𝒮𝒯𝐼𝒩𝐼 ♛ (@luhh.desss)', 'al:ios:app_store_id': '389801252', 'al:android:url': 'https://www.instagram.com/_u/luhh.desss/', 'apple-mobile-web-app-status-bar-style': 'default', 'viewport': 'width=device-width, initial-scale=1, minimum-scale=1, maximum-scale=1, viewport-fit=cover', 'mobile-web-app-capable': 'yes', 'og:url': 'https://www.instagram.com/luhh.desss/', 'al:android:app_name': 'Instagram'}]",[{'src': 'https://scontent-atl3-1.cdninstagram.com/v/t51.2885-19/316507712_792806941780426_7899924806661813938_n.jpg?stp=dst-jpg_s150x150&_nc_ht=scontent-atl3-1.cdninstagram.com&_nc_cat=110&_nc_ohc=FhzaglcriEoAX83tB50&edm=ABfd0MgBAAAA&ccb=7-5&oh=00_AfA7wZtDPZmU_ZBo5H_wixNogPOhrENYuhQ8IYC5zWjWcQ&oe=63B2D278&_nc_sid=7bff83'}],[{}],,,,,,,,,"width=device-width, initial-scale=1, minimum-scale=1, maximum-scale=1, viewport-fit=cover",,https://scontent-atl3-1.cdninstagram.com/v/t51.2885-19/316507712_792806941780426_7899924806661813938_n.jpg?stp=dst-jpg_s150x150&_nc_ht=scontent-atl3-1.cdninstagram.com&_nc_cat=110&_nc_ohc=FhzaglcriEoAX83tB50&edm=ABfd0MgBAAAA&ccb=7-5&oh=00_AfA7wZtDPZmU_ZBo5H_wixNogPOhrENYuhQ8IYC5zWjWcQ&oe=63B2D278&_nc_sid=7bff83,profile,,,,Instagram,,𝒟𝐸𝒮𝒯𝐼𝒩𝐼 ♛ (@luhh.desss) • Instagram photos and videos,com.instagram.android,,,instagram://user?username=luhh.desss,"120k Followers, 887 Following, 38 Posts - See Instagram photos and videos from 𝒟𝐸𝒮𝒯𝐼𝒩𝐼 ♛ (@luhh.desss)",389801252,,https://www.instagram.com/_u/luhh.desss/,,,https://www.instagram.com/luhh.desss/,Instagram,,#ffffff,,,,,,,default,yes,,,,,,,,,,,,,,,,,,,,,,,,,,,,,,,,,,,,,,,,,,,,,,,,,,,,,,,,,,,,,,,,,,,,,,,,,,,,,,,,,,,,,,,,,,,,
