22,python,3,Download Python | Python.org,Python was created in the early 1990s by Guido van Rossum at Stichting Mathematisch Centrum in the Netherlands as a successor of a language called ABC. Guido ...,www.python.org,https://www.python.org/downloads/,2023-01-02 08:39:11.645355+00:00,1350000000,mKMOugLFVo8J,10,desss,a283296b1cb8147fd,0.37,"1,350,000,000",https://www.python.org/downloads/,https://www.<b>python</b>.org/downloads/,<b>Python</b> was created in the early 1990s by Guido van Rossum at Stichting Mathematisch Centrum in the Netherlands as a successor of a language called ABC. Guido&nbsp;...,Download <b>Python</b> | <b>Python</b>.org,utf8,customsearch#result,utf8,"{'cse_thumbnail': [{'src': 'https://encrypted-tbn1.gstatic.com/images?q=tbn:ANd9GcT-wRuWdLHQDV50Bvs30LBfvbDRoaXHxbiZ1CXFrsMnEPMz94ccOmx8z5xE', 'width': '200', 'height': '200'}], 'metatags': [{'application-name': 'Python.org', 'msapplication-tilecolor': '#3673a5', 'og:image': 'https://www.python.org/static/opengraph-icon-200x200.png', 'og:type': 'website', 'og:site_name': 'Python.org', 'handheldfriendly': 'True', 'msapplication-tooltip': 'The official home of the Python Programming Language', 'apple-mobile-web-app-title': 'Python.org', 'og:title': 'Download Python', 'msapplication-tileimage': '/static/metro-icon-144x144-precomposed.png', 'msapplication-navbutton-color': '#3673a5', 'og:description': 'The official home of the Python Programming Language', 'og:image:secure_url': 'https://www.python.org/static/opengraph-icon-200x200.png', 'apple-mobile-web-app-status-bar-style': 'black', 'viewport': 'width=device-width, initial-scale=1.0', 'apple-mobile-web-app-capable': 'yes', 'og:url': 'https://www.python.org/downloads/', 'format-detection': 'telephone=no'}], 'cse_image': [{'src': 'https://www.python.org/static/opengraph-icon-200x200.png'}]}",off,0.374982,1,"[{'src': 'https://encrypted-tbn1.gstatic.com/images?q=tbn:ANd9GcT-wRuWdLHQDV50Bvs30LBfvbDRoaXHxbiZ1CXFrsMnEPMz94ccOmx8z5xE', 'width': '200', 'height': '200'}]","[{'application-name': 'Python.org', 'msapplication-tilecolor': '#3673a5', 'og:image': 'https://www.python.org/static/opengraph-icon-200x200.png', 'og:type': 'website', 'og:site_name': 'Python.org', 'handheldfriendly': 'True', 'msapplication-tooltip': 'The official home of the Python Programming Language', 'apple-mobile-web-app-title': 'Python.org', 'og:title': 'Download Python', 'msapplication-tileimage': '/static/metro-icon-144x144-precomposed.png', 'msapplication-navbutton-color': '#3673a5', 'og:description': 'The official home of the Python Programming Language', 'og:image:secure_url': 'https://www.python.org/static/opengraph-icon-200x200.png', 'apple-mobile-web-app-status-bar-style': 'black', 'viewport': 'width=device-width, initial-scale=1.0', 'apple-mobile-web-app-capable': 'yes', 'og:url': 'https://www.python.org/downloads/', 'format-detection': 'telephone=no'}]",[{'src': 'https://www.python.org/static/opengraph-icon-200x200.png'}],,,,,,,,,,"width=device-width, initial-scale=1.0",,https://www.python.org/static/opengraph-icon-200x200.png,website,,,,,,Download Python,,,,,The official home of the Python Programming Language,,,,,,https://www.python.org/downloads/,,#3673a5,,,,,Python.org,,https://www.python.org/static/opengraph-icon-200x200.png,black,,,,telephone=no,,,True,,,,,,/static/metro-icon-144x144-precomposed.png,,,,,,,,,,,,,,,,,,,,,,,,,,,,,,,,,,,,,,,,,,,Python.org,The official home of the Python Programming Language,Python.org,#3673a5,yes,,,,,,,,,,,,,,,,,,,,,,,,,,,,,,,,,
23,python,4,Python (programming language) - Wikipedia,"Python is dynamically-typed and garbage-collected. It supports multiple programming paradigms, including structured (particularly procedural), object-oriented ...",en.wikipedia.org,https://en.wikipedia.org/wiki/Python_(programming_language),2023-01-02 08:39:11.645355+00:00,1350000000,3wRBXLyvECcJ,10,desss,a283296b1cb8147fd,0.37,"1,350,000,000",https://en.wikipedia.org/wiki/Python_(programming_language),https://en.wikipedia.org/wiki/<b>Python</b>_(programming_language),"<b>Python</b> is dynamically-typed and garbage-collected. It supports multiple programming paradigms, including structured (particularly procedural), object-oriented&nbsp;...",<b>Python</b> (programming language) - Wikipedia,utf8,customsearch#result,utf8,"{'metatags': [{'referrer': 'origin', 'og:image': 'https://upload.wikimedia.org/wikipedia/commons/thumb/c/c3/Python-logo-notext.svg/1200px-Python-logo-notext.svg.png', 'theme-color': '#eaecf0', 'og:image:width': '1200', 'og:type': 'website', 'viewport': 'width=device-width, initial-scale=1.0, user-scalable=yes, minimum-scale=0.25, maximum-scale=5.0', 'og:title': 'Python (programming language) - Wikipedia', 'og:image:height': '1315', 'format-detection': 'telephone=no'}]}",off,0.374982,1,,"[{'referrer': 'origin', 'og:image': 'https://upload.wikimedia.org/wikipedia/commons/thumb/c/c3/Python-logo-notext.svg/1200px-Python-logo-notext.svg.png', 'theme-color': '#eaecf0', 'og:image:width': '1200', 'og:type': 'website', 'viewport': 'width=device-width, initial-scale=1.0, user-scalable=yes, minimum-scale=0.25, maximum-scale=5.0', 'og:title': 'Python (programming language) - Wikipedia', 'og:image:height': '1315', 'format-detection': 'telephone=no'}]",,,,,,,,,,,"width=device-width, initial-scale=1.0, user-scalable=yes, minimum-scale=0.25, maximum-scale=5.0",,https://upload.wikimedia.org/wikipedia/commons/thumb/c/c3/Python-logo-notext.svg/1200px-Python-logo-notext.svg.png,website,,,,,,Python (programming language) - Wikipedia,,,,,,,,,,,,,,#eaecf0,,,1200,,1315,,,,,,telephone=no,,,,,,,,,,,,,,origin,,,,,,,,,,,,,,,,,,,,,,,,,,,,,,,,,,,,,,,,,,,,,,,,,,,,,,,,,,,,,,,,,,,,,,,,,,,
24,python,5,The Python Tutorial — Python 3.11.1 documentation,"Python is an easy to learn, powerful programming language. It has efficient high-level data structures and a simple but effective approach to ...",docs.python.org,https://docs.python.org/3/tutorial/,2023-01-02 08:39:11.645355+00:00,1350000000,FcZ5ySfi_xYJ,10,desss,a283296b1cb8147fd,0.37,"1,350,000,000",https://docs.python.org/3/tutorial/,https://docs.<b>python</b>.org/3/tutorial/,"<b>Python</b> is an easy to learn, powerful programming language. It has efficient high-level data structures and a simple but effective approach to&nbsp;...",The <b>Python</b> Tutorial — <b>Python</b> 3.11.1 documentation,utf8,customsearch#result,utf8,"{'cse_thumbnail': [{'src': 'https://encrypted-tbn1.gstatic.com/images?q=tbn:ANd9GcQ0o3uDlERm3RSZ54TCeoDN14moS7xHs1hbH7QgJM1nFOyOGmJgE0ze3tc', 'width': '200', 'height': '200'}], 'metatags': [{'og:image': 'https://docs.python.org/3/_static/og-image.png', 'og:type': 'website', 'og:image:alt': 'Python documentation', 'og:image:width': '200', 'theme-color': '#3776ab', 'og:site_name': 'Python documentation', 'viewport': 'width=device-width, initial-scale=1.0', 'og:title': 'The Python Tutorial', 'og:image:height': '200', 'og:url': 'https://docs.python.org/3/tutorial/index.html', 'og:description': 'Python is an easy to learn, powerful programming language. It has efficient high-level data structures and a simple but effective approach to object-oriented programming. Python’s elegant syntax an...'}], 'cse_image': [{'src': 'https://docs.python.org/3/_static/og-image.png'}]}",off,0.374982,1,"[{'src': 'https://encrypted-tbn1.gstatic.com/images?q=tbn:ANd9GcQ0o3uDlERm3RSZ54TCeoDN14moS7xHs1hbH7QgJM1nFOyOGmJgE0ze3tc', 'width': '200', 'height': '200'}]","[{'og:image': 'https://docs.python.org/3/_static/og-image.png', 'og:type': 'website', 'og:image:alt': 'Python documentation', 'og:image:width': '200', 'theme-color': '#3776ab', 'og:site_name': 'Python documentation', 'viewport': 'width=device-width, initial-scale=1.0', 'og:title': 'The Python Tutorial', 'og:image:height': '200', 'og:url': 'https://docs.python.org/3/tutorial/index.html', 'og:description': 'Python is an easy to learn, powerful programming language. It has efficient high-level data structures and a simple but effective approach to object-oriented programming. Python’s elegant syntax an...'}]",[{'src': 'https://docs.python.org/3/_static/og-image.png'}],,,,,,,,,,"width=device-width, initial-scale=1.0",,https://docs.python.org/3/_static/og-image.png,website,,,,,,The Python Tutorial,,,,,"Python is an easy to learn, powerful programming language. It has efficient high-level data structures and a simple but effective approach to object-oriented programming. Python’s elegant syntax an...",,,,,,https://docs.python.org/3/tutorial/index.html,,,#3776ab,,Python documentation,200,Python documentation,200,,,,,,,,,,,,,,,,,,,,,,,,,,,,,,,,,,,,,,,,,,,,,,,,,,,,,,,,,,,,,,,,,,,,,,,,,,,,,,,,,,,,,,,,,,,,,,,
25,python,6,Python Courses & Tutorials | Codecademy,"Python is a general-purpose, versatile, and powerful programming language. It's a great first language because Python code is concise and easy to read.",www.codecademy.com,https://www.codecademy.com/catalog/language/python,2023-01-02 08:39:11.645355+00:00,1350000000,AJ2qJ46y8nQJ,10,desss,a283296b1cb8147fd,0.37,"1,350,000,000",https://www.codecademy.com/catalog/language/python,https://www.codecademy.com/catalog/language/<b>python</b>,"<b>Python</b> is a general-purpose, versatile, and powerful programming language. It&#39;s a great first language because <b>Python</b> code is concise and easy to read.",<b>Python</b> Courses &amp; Tutorials | Codecademy,utf8,customsearch#result,utf8,"{'cse_thumbnail': [{'src': 'https://encrypted-tbn2.gstatic.com/images?q=tbn:ANd9GcSeSIzcQrS7QZR5tfWx0hp68RbiAbhL4M6L3ex3chvuPb_xApS7BXx19h5w', 'width': '310', 'height': '163'}], 'metatags': [{'apple-itunes-app': 'app-id=1376029326', 'og:image': 'https://images.codecademy.com/social/logo-codecademy-social.png', 'fb:profile_id': 'codecademy', 'og:type': 'website', 'twitter:card': 'summary', 'twitter:title': 'Python Courses & Tutorials | Codecademy', 'og:site_name': 'Codecademy', 'og:title': 'Python Courses & Tutorials | Codecademy', 'og:description': ""Python is a general-purpose, versatile, and powerful programming language. It's a great first language because Python code is concise and easy to read. Whatever you want to do, python can do it. From web development to machine learning to data science, Python is the language for you."", 'twitter:image': 'https://images.codecademy.com/social/logo-codecademy-social.png', 'next-head-count': '37', 'fb:app_id': '307818116683104', 'twitter:site': '@codecademy', 'viewport': 'width=device-width', 'twitter:description': ""Python is a general-purpose, versatile, and powerful programming language. It's a great first language because Python code is concise and easy to read. Whatever you want to do, python can do it. From web development to machine learning to data science, Python is the language for you."", 'og:rich_attachment': 'true'}], 'cse_image': [{'src': 'https://images.codecademy.com/social/logo-codecademy-social.png'}]}",off,0.374982,1,"[{'src': 'https://encrypted-tbn2.gstatic.com/images?q=tbn:ANd9GcSeSIzcQrS7QZR5tfWx0hp68RbiAbhL4M6L3ex3chvuPb_xApS7BXx19h5w', 'width': '310', 'height': '163'}]","[{'apple-itunes-app': 'app-id=1376029326', 'og:image': 'https://images.codecademy.com/social/logo-codecademy-social.png', 'fb:profile_id': 'codecademy', 'og:type': 'website', 'twitter:card': 'summary', 'twitter:title': 'Python Courses & Tutorials | Codecademy', 'og:site_name': 'Codecademy', 'og:title': 'Python Courses & Tutorials | Codecademy', 'og:description': ""Python is a general-purpose, versatile, and powerful programming language. It's a great first language because Python code is concise and easy to read. Whatever you want to do, python can do it. From web development to machine learning to data science, Python is the language for you."", 'twitter:image': 'https://images.codecademy.com/social/logo-codecademy-social.png', 'next-head-count': '37', 'fb:app_id': '307818116683104', 'twitter:site': '@codecademy', 'viewport': 'width=device-width', 'twitter:description': ""Python is a general-purpose, versatile, and powerful programming language. It's a great first language because Python code is concise and easy to read. Whatever you want to do, python can do it. From web development to machine learning to data science, Python is the language for you."", 'og:rich_attachment': 'true'}]",[{'src': 'https://images.codecademy.com/social/logo-codecademy-social.png'}],,,,,,,,,,width=device-width,,https://images.codecademy.com/social/logo-codecademy-social.png,website,summary,Python Courses & Tutorials | Codecademy,,,,Python Courses & Tutorials | Codecademy,,,,,"Python is a general-purpose, versatile, and powerful programming language. It's a great first language because Python code is concise and easy to read. Whatever you want to do, python can do it. From web development to machine learning to data science, Python is the language for you.",,https://images.codecademy.com/social/logo-codecademy-social.png,,@codecademy,"Python is a general-purpose, versatile, and powerful programming language. It's a great first language because Python code is concise and easy to read. Whatever you want to do, python can do it. From web development to machine learning to data science, Python is the language for you.",,,,,,,,Codecademy,,,,,,,,,,,,,,,,,,,,,,,,37,,,,,app-id=1376029326,,,,,,,,,,,,,,,,,,,,,,,,,,307818116683104,,,,,,,,,codecademy,true,,,,,,,,,,,,,,,,,,,,,,,,,,,,,,,
26,python,7,Python Docs,This is the official documentation for Python 3.11.1. Parts of the documentation: ... installing from the Python Package Index & other sources.,docs.python.org,https://docs.python.org/,2023-01-02 08:39:11.645355+00:00,1350000000,jjH3gjHSX2wJ,10,desss,a283296b1cb8147fd,0.37,"1,350,000,000",https://docs.python.org/,https://docs.<b>python</b>.org/,This is the official documentation for <b>Python</b> 3.11.1. Parts of the documentation: ... installing from the <b>Python</b> Package Index &amp; other sources.,<b>Python</b> Docs,utf8,customsearch#result,utf8,"{'metatags': [{'viewport': 'width=device-width, initial-scale=1.0'}]}",off,0.374982,1,,"[{'viewport': 'width=device-width, initial-scale=1.0'}]",,,,,,,,,,,"width=device-width, initial-scale=1.0",,,,,,,,,,,,,,,,,,,,,,,,,,,,,,,,,,,,,,,,,,,,,,,,,,,,,,,,,,,,,,,,,,,,,,,,,,,,,,,,,,,,,,,,,,,,,,,,,,,,,,,,,,,,,,,,,,,,,,,,,,,
27,python,8,python - Official Image | Docker Hub,"python. Docker Official Image. •. 1B+. •. 8.3K. Python is an interpreted, interactive, object-oriented, open-source programming language. docker pull python.",hub.docker.com,https://hub.docker.com/_/python,2023-01-02 08:39:11.645355+00:00,1350000000,Fzb3FZVdGiQJ,10,desss,a283296b1cb8147fd,0.37,"1,350,000,000",https://hub.docker.com/_/python,https://hub.docker.com/_/<b>python</b>,"<b>python</b>. Docker Official Image. •. 1B+. •. 8.3K. <b>Python</b> is an interpreted, interactive, object-oriented, open-source programming language. docker pull <b>python</b>.",<b>python</b> - Official Image | Docker Hub,utf8,customsearch#result,utf8,"{'metatags': [{'viewport': 'width=device-width, initial-scale=1.0, maximum-scale=1.0, user-scalable=0'}]}",off,0.374982,1,,"[{'viewport': 'width=device-width, initial-scale=1.0, maximum-scale=1.0, user-scalable=0'}]",,,,,,,,,,,"width=device-width, initial-scale=1.0, maximum-scale=1.0, user-scalable=0",,,,,,,,,,,,,,,,,,,,,,,,,,,,,,,,,,,,,,,,,,,,,,,,,,,,,,,,,,,,,,,,,,,,,,,,,,,,,,,,,,,,,,,,,,,,,,,,,,,,,,,,,,,,,,,,,,,,,,,,,,,
28,python,9,The Python Standard Library — Python 3.11.1 documentation,"While The Python Language Reference describes the exact syntax and semantics of the Python language, this library reference manual describes the standard ...",docs.python.org,https://docs.python.org/3/library/,2023-01-02 08:39:11.645355+00:00,1350000000,nTas6KVcOSQJ,10,desss,a283296b1cb8147fd,0.37,"1,350,000,000",https://docs.python.org/3/library/,https://docs.<b>python</b>.org/3/library/,"While The <b>Python</b> Language Reference describes the exact syntax and semantics of the <b>Python</b> language, this library reference manual describes the standard&nbsp;...",The <b>Python</b> Standard Library — <b>Python</b> 3.11.1 documentation,utf8,customsearch#result,utf8,"{'cse_thumbnail': [{'src': 'https://encrypted-tbn1.gstatic.com/images?q=tbn:ANd9GcQ0o3uDlERm3RSZ54TCeoDN14moS7xHs1hbH7QgJM1nFOyOGmJgE0ze3tc', 'width': '200', 'height': '200'}], 'metatags': [{'og:image': 'https://docs.python.org/3/_static/og-image.png', 'og:type': 'website', 'og:image:alt': 'Python documentation', 'og:image:width': '200', 'theme-color': '#3776ab', 'og:site_name': 'Python documentation', 'viewport': 'width=device-width, initial-scale=1.0', 'og:title': 'The Python Standard Library', 'og:image:height': '200', 'og:url': 'https://docs.python.org/3/library/index.html', 'og:description': 'While The Python Language Reference describes the exact syntax and semantics of the Python language, this library reference manual describes the standard library that is distributed with Python. It...'}], 'cse_image': [{'src': 'https://docs.python.org/3/_static/og-image.png'}]}",off,0.374982,1,"[{'src': 'https://encrypted-tbn1.gstatic.com/images?q=tbn:ANd9GcQ0o3uDlERm3RSZ54TCeoDN14moS7xHs1hbH7QgJM1nFOyOGmJgE0ze3tc', 'width': '200', 'height': '200'}]","[{'og:image': 'https://docs.python.org/3/_static/og-image.png', 'og:type': 'website', 'og:image:alt': 'Python documentation', 'og:image:width': '200', 'theme-color': '#3776ab', 'og:site_name': 'Python documentation', 'viewport': 'width=device-width, initial-scale=1.0', 'og:title': 'The Python Standard Library', 'og:image:height': '200', 'og:url': 'https://docs.python.org/3/library/index.html', 'og:description': 'While The Python Language Reference describes the exact syntax and semantics of the Python language, this library reference manual describes the standard library that is distributed with Python. It...'}]",[{'src': 'https://docs.python.org/3/_static/og-image.png'}],,,,,,,,,,"width=device-width, initial-scale=1.0",,https://docs.python.org/3/_static/og-image.png,website,,,,,,The Python Standard Library,,,,,"While The Python Language Reference describes the exact syntax and semantics of the Python language, this library reference manual describes the standard library that is distributed with Python. It...",,,,,,https://docs.python.org/3/library/index.html,,,#3776ab,,Python documentation,200,Python documentation,200,,,,,,,,,,,,,,,,,,,,,,,,,,,,,,,,,,,,,,,,,,,,,,,,,,,,,,,,,,,,,,,,,,,,,,,,,,,,,,,,,,,,,,,,,,,,,,,
29,python,10,Google's Python Class | Python Education | Google Developers,"Jul 25, 2015 ... Welcome to Google's Python Class -- this is a free class for people with a little bit of programming experience who want to learn Python.",developers.google.com,https://developers.google.com/edu/python,2023-01-02 08:39:11.645355+00:00,1350000000,ywRkyQXGTWMJ,10,desss,a283296b1cb8147fd,0.37,"1,350,000,000",https://developers.google.com/edu/python,https://developers.google.com/edu/<b>python</b>,"Jul 25, 2015 <b>...</b> Welcome to Google&#39;s <b>Python</b> Class -- this is a free class for people with a little bit of programming experience who want to learn <b>Python</b>.",Google&#39;s <b>Python</b> Class | <b>Python</b> Education | Google Developers,utf8,customsearch#result,utf8,"{'cse_thumbnail': [{'src': 'https://encrypted-tbn3.gstatic.com/images?q=tbn:ANd9GcRYP3jCJ6fR8St_r1en9LYwBwDmtbvtnG6BjQeGpYDUlBMsLsqL8iRu3-kg', 'width': '310', 'height': '163'}], 'document': [{}], 'metatags': [{'og:image': 'https://www.gstatic.com/devrel-devsite/prod/vdbc400b97a86c8815ab6ee057e8dc91626aee8cf89b10f7d89037e5a33539f53/developers/images/opengraph/cyan.png', 'og:type': 'website', 'theme-color': '#12b5cb', 'og:image:width': '1200', 'twitter:card': 'summary_large_image', 'google-signin-client-id': '721724668570-nbkv1cfusk7kk4eni4pjvepaus73b13t.apps.googleusercontent.com', 'og:site_name': 'Google Developers', 'og:title': ""Google's Python Class \xa0|\xa0 Python Education \xa0|\xa0 Google Developers"", 'og:image:height': '675', 'og:description': 'Assorted educational materials provided by Google.', 'viewport': 'width=device-width, initial-scale=1', 'og:locale': 'en', 'google-signin-scope': 'profile email https://www.googleapis.com/auth/developerprofiles https://www.googleapis.com/auth/developerprofiles.award', 'og:url': 'https://developers.google.com/edu/python'}], 'cse_image': [{'src': 'https://www.gstatic.com/devrel-devsite/prod/vdbc400b97a86c8815ab6ee057e8dc91626aee8cf89b10f7d89037e5a33539f53/developers/images/opengraph/cyan.png'}]}",off,0.374982,1,"[{'src': 'https://encrypted-tbn3.gstatic.com/images?q=tbn:ANd9GcRYP3jCJ6fR8St_r1en9LYwBwDmtbvtnG6BjQeGpYDUlBMsLsqL8iRu3-kg', 'width': '310', 'height': '163'}]","[{'og:image': 'https://www.gstatic.com/devrel-devsite/prod/vdbc400b97a86c8815ab6ee057e8dc91626aee8cf89b10f7d89037e5a33539f53/developers/images/opengraph/cyan.png', 'og:type': 'website', 'theme-color': '#12b5cb', 'og:image:width': '1200', 'twitter:card': 'summary_large_image', 'google-signin-client-id': '721724668570-nbkv1cfusk7kk4eni4pjvepaus73b13t.apps.googleusercontent.com', 'og:site_name': 'Google Developers', 'og:title': ""Google's Python Class \xa0|\xa0 Python Education \xa0|\xa0 Google Developers"", 'og:image:height': '675', 'og:description': 'Assorted educational materials provided by Google.', 'viewport': 'width=device-width, initial-scale=1', 'og:locale': 'en', 'google-signin-scope': 'profile email https://www.googleapis.com/auth/developerprofiles https://www.googleapis.com/auth/developerprofiles.award', 'og:url': 'https://developers.google.com/edu/python'}]",[{'src': 'https://www.gstatic.com/devrel-devsite/prod/vdbc400b97a86c8815ab6ee057e8dc91626aee8cf89b10f7d89037e5a33539f53/developers/images/opengraph/cyan.png'}],,,[{}],,,,,,,"width=device-width, initial-scale=1",,https://www.gstatic.com/devrel-devsite/prod/vdbc400b97a86c8815ab6ee057e8dc91626aee8cf89b10f7d89037e5a33539f53/developers/images/opengraph/cyan.png,website,summary_large_image,,,,,Google's Python Class  |  Python Education  |  Google Developers,,,,,Assorted educational materials provided by Google.,,,,,,https://developers.google.com/edu/python,,,#12b5cb,,,1200,Google Developers,675,,,,,,,,,,,,,,,,,,,en,,,,,,,,,,,,,,,,,,,,,,,,,,,,,,,,,,,,,,,,,,,,,,721724668570-nbkv1cfusk7kk4eni4pjvepaus73b13t.apps.googleusercontent.com,profile email https://www.googleapis.com/auth/developerprofiles https://www.googleapis.com/auth/developerprofiles.award,,,,,,,,,,,,,,,,,,,,,,,,,,,,,
